Symbol,Name,Last Sale,Net Change,% Change,Market Cap,Country,IPO Year,Volume,Sector,Industry
CW,Curtiss-Wright Corporation Common Stock,$157.99,3.76,2.438%,6071899644.00,United States,,227071,Capital Goods,Industrial Machinery/Components
CWEN,Clearway Energy Inc. Class C Common Stock,$35.00,0.92,2.70%,4076452835.00,United States,2015,944683,Public Utilities,Electric Utilities: Central
CWH,Camping World Holdings Inc. Class A Commom Stock,$26.92,-1.28,-4.539%,1135133594.00,United States,2016,1460866,Consumer Services,Other Specialty Stores
CWST,Casella Waste Systems Inc. Class A Common Stock,$88.46,0.18,0.204%,4567960994.00,United States,1997,176092,Public Utilities,Environmental Services
CWT,California Water Service Group Common Stock,$56.15,1.16,2.109%,3019122107.00,United States,,256300,Public Utilities,Water Supply
CXW,CoreCivic Inc. Common Stock,$13.81,0.02,0.145%,1676113541.00,United States,,1838583,Consumer Services,Real Estate Investment Trusts
CYBE,CyberOptics Corporation Common Stock,$42.26,0.28,0.667%,312837384.00,United States,1987,41592,Capital Goods,Electronic Components
CYH,Community Health Systems Inc. Common Stock,$11.68,0.35,3.089%,1572987496.00,United States,2000,849575,Health Care,Hospital/Nursing Management
CYRX,CryoPort Inc. Common Stock,$29.61,-1.32,-4.268%,1471499656.00,United States,,248622,,
CYTK,Cytokinetics Incorporated Common Stock,$37.81,-0.12,-0.316%,3232904009.00,United States,2004,538377,Health Care,Biotechnology: Pharmaceutical Preparations
CYXT,Cyxtera Technologies Inc. Class A Common Stock,$13.62,0.55,4.208%,2432073714.00,United States,2020,833838,Technology,EDP Services
CZNC,Citizens & Northern Corp Common Stock,$25.02,0.29,1.173%,395945378.00,United States,,18358,Finance,Major Banks
CZR,Caesars Entertainment Inc. Common Stock,$71.70,-0.05,-0.07%,15352651437.00,United States,,2106980,Consumer Services,Hotels/Resorts
D,Dominion Energy Inc. Common Stock,$86.99,0.02,0.023%,70520522648.00,United States,,2893429,Public Utilities,Electric Utilities: Central
DAL,Delta Air Lines Inc. Common Stock,$43.54,0.50,1.162%,27912469199.00,United States,,17404417,Transportation,Air Freight/Delivery Services
DAN,Dana Incorporated Common Stock ,$16.55,0.01,0.06%,2396716832.00,United States,,1048647,Capital Goods,Auto Parts:O.E.M.
DAR,Darling Ingredients Inc. Common Stock,$86.07,3.39,4.10%,13906773074.00,United States,,1737797,Consumer Non-Durables,Farming/Seeds/Milling
DAVA,Endava plc American Depositary Shares (each representing one Class A Ordinary Share),$117.57,-1.89,-1.582%,6583225984.00,United States,2018,270327,Technology,EDP Services
DAVE,Dave Inc. Class A Common Stock,$5.00,0.04,0.806%,1860002500.00,United States,,666701,Technology,Retail: Computer Software & Peripheral Equipment
DAWN,Day One Biopharmaceuticals Inc. Common Stock,$11.16,0.15,1.362%,691920000.00,United States,2021,69507,Health Care,Biotechnology: Pharmaceutical Preparations
DBD,Diebold Nixdorf Incorporated Common Stock,$5.79,0.24,4.324%,456989843.00,United States,,1764716,Technology,EDP Services
DBI,Designer Brands Inc. Class A Common Stock,$15.28,-0.03,-0.196%,1104510124.00,United States,,1161242,Consumer Services,Clothing/Shoe/Accessory Stores
DBRG,DigitalBridge Group Inc.,$7.32,-0.21,-2.789%,4381546030.00,United States,2014,3146504,Consumer Services,Real Estate Investment Trusts
DBX,Dropbox Inc. Class A Common Stock,$22.49,-0.69,-2.977%,8500174058.00,United States,2018,3375701,Technology,Computer Software: Prepackaged Software
DCGO,DocGo Inc. Common Stock,$8.06,0.08,1.003%,807404657.00,United States,2020,547652,Health Care,Managed Health Care
DCI,Donaldson Company Inc. Common Stock,$52.60,0.79,1.525%,58492337159.00,United States,,258666,Capital Goods,Pollution Control Equipment
DCO,Ducommun Incorporated Common Stock,$57.20,0.69,1.221%,684819450.00,United States,,38807,Capital Goods,Military/Government/Technical
DCOM,Dime Community Bancshares Inc. Common Stock,$36.28,0.10,0.276%,1431605499.00,United States,,166668,Finance,Savings Institutions
DCP,DCP Midstream  LP Common Units ,$39.02,1.43,3.804%,8130938396.00,United States,,905542,Public Utilities,Natural Gas Distribution
DCPH,Deciphera Pharmaceuticals Inc. Common Stock,$10.26,0.24,2.395%,600747337.00,United States,2017,834328,Health Care,Biotechnology: Pharmaceutical Preparations
DCRD,Decarbonization Plus Acquisition Corporation IV Class A Ordinary Share,$9.94,0.01,0.101%,392940625.00,United States,2021,220,,
DCT,Duck Creek Technologies Inc. Common Stock,$17.08,-0.83,-4.634%,2263502012.00,United States,2020,636346,Technology,Retail: Computer Software & Peripheral Equipment
DDD,3D Systems Corporation Common Stock,$13.99,-0.29,-2.031%,1823681321.00,United States,,785486,Technology,Computer peripheral equipment
DDOG,Datadog Inc. Class A Common Stock,$131.62,-5.66,-4.123%,41316794582.00,United States,2019,2123493,Technology,EDP Services
DDS,Dillard's Inc. Common Stock,$306.66,0.74,0.242%,5587748151.00,United States,,159856,Consumer Services,Department/Specialty Retail Stores
DE,Deere & Company Common Stock,$437.39,-0.43,-0.098%,134184396787.00,United States,,1717849,Capital Goods,Industrial Machinery/Components
DEA,Easterly Government Properties Inc. Common Stock,$20.41,0.18,0.89%,1843798009.00,United States,2015,473231,Consumer Services,Real Estate Investment Trusts
DECK,Deckers Outdoor Corporation Common Stock,$289.63,-0.73,-0.251%,7889892795.00,United States,1993,425549,Consumer Non-Durables,Shoe Manufacturing
DEI,Douglas Emmett Inc. Common Stock,$31.63,0.41,1.313%,5559654696.00,United States,2006,747569,Consumer Services,Real Estate Investment Trusts
DENN,Denny's Corporation Common Stock,$13.22,-0.01,-0.076%,815838615.00,United States,,326450,Consumer Services,Restaurants
DFH,Dream Finders Homes Inc. Class A Common Stock,$18.17,0.26,1.452%,1685429885.00,United States,2021,277584,,
DFS,Discover Financial Services Common Stock,$118.82,0.07,0.059%,33510578604.00,United States,,1235516,Finance,Finance: Consumer Services
DG,Dollar General Corporation Common Stock,$259.04,3.68,1.441%,59264431948.00,United States,2009,2117334,Consumer Services,Department/Specialty Retail Stores
DGICA,Donegal Group Inc. Class A Common Stock,$13.52,0.23,1.731%,424050703.00,United States,,26365,Finance,Property-Casualty Insurers
DGICB,Donegal Group Inc. Class B Common Stock,$13.11,-0.4499,-3.318%,411191178.00,United States,1986,1786,Finance,Property-Casualty Insurers
DGII,Digi International Inc. Common Stock,$20.34,0.01,0.049%,711779974.00,United States,1989,87150,Technology,Computer peripheral equipment
DGNU,Dragoneer Growth Opportunities Corp. III Class A Ordinary Shares,$9.82,-0.03,-0.305%,528654869.00,United States,2021,21043,Finance,Business Services
DGX,Quest Diagnostics Incorporated Common Stock,$138.45,2.57,1.891%,16538514429.00,United States,,1157724,Health Care,Medical Specialities
DH,Definitive Healthcare Corp. Class A Common Stock,$25.84,-0.04,-0.155%,2521045569.00,United States,2021,396459,Technology,Computer Software: Prepackaged Software
DHBC,DHB Capital Corp. Class A common stock,$9.7975,-0.0025,-0.026%,352097656.00,United States,2021,302,Consumer Durables,Consumer Electronics/Appliances
DHBCU,DHB Capital Corp. Unit,$9.87,0.03,0.305%,354703125.00,United States,2021,3882,Consumer Durables,Consumer Electronics/Appliances
DHC,Diversified Healthcare Trust Common Shares of Beneficial Interest,$2.69,-0.08,-2.888%,642883084.00,United States,,1031118,Consumer Services,Real Estate Investment Trusts
DHCA,DHC Acquisition Corp. Class A ordinary share,$9.79,-0.02,-0.204%,378690319.00,United States,2021,84099,Finance,Business Services
DHHC,DiamondHead Holdings Corp. Class A Common Stock,$9.82,0.00,0.00%,423487500.00,United States,2021,10416,Consumer Durables,Consumer Electronics/Appliances
DHI,D.R. Horton Inc. Common Stock,$74.59,0.47,0.634%,26431575527.00,United States,,2618471,,
DHIL,Diamond Hill Investment Group Inc. Class A Common Stock,$183.94,4.59,2.559%,592496492.00,United States,,3750,Finance,Investment Managers
DHR,Danaher Corporation Common Stock,$280.38,7.28,2.666%,200722610660.00,United States,,3793304,Health Care,Medical Specialities
DICE,DICE Therapeutics Inc. Common Stock,$21.98,0.83,3.924%,840326502.00,United States,2021,462270,Health Care,Biotechnology: Pharmaceutical Preparations
DIN,Dine Brands Global Inc. Common Stock,$76.40,1.32,1.758%,1287473012.00,United States,,107189,Consumer Services,Restaurants
DINO,HF Sinclair Corporation Common Stock,$40.53,0.53,1.325%,9047574559.00,United States,,1270570,Energy,Integrated oil Companies
DIOD,Diodes Incorporated Common Stock,$75.27,0.02,0.027%,3404596382.00,United States,,372631,Technology,Semiconductors
DIS,Walt Disney Company (The) Common Stock,$124.57,-7.33,-5.557%,226796303635.00,United States,,36391670,Consumer Services,Movies/Entertainment
DISA,Disruptive Acquisition Corporation I Class A Ordinary Shares,$9.81,0.00,0.00%,337218750.00,United States,2021,2,Finance,Business Services
DISH,DISH Network Corporation Class A Common Stock,$32.95,-0.55,-1.642%,17430938546.00,United States,1995,2322662,Consumer Services,Television Services
DJCO,Daily Journal Corp. (S.C.) Common Stock,$273.20,-8.60,-3.052%,377219807.00,United States,,7664,Technology,Retail: Computer Software & Peripheral Equipment
DK,Delek US Holdings Inc. Common Stock,$24.60,-0.29,-1.165%,2172687055.00,United States,2017,1036678,Energy,Integrated oil Companies
DKL,Delek Logistics Partners L.P. Common Units representing Limited Partner Interests,$52.32,2.52,5.06%,2274395029.00,United States,2012,72113,Energy,Oil & Gas Production
DKNG,DraftKings Inc. Class A Common Stock,$15.56,-1.32,-7.82%,6359016750.00,United States,2019,20980033,Consumer Services,Services-Misc. Amusement & Recreation
DKS,Dick's Sporting Goods Inc Common Stock,$107.51,-0.59,-0.546%,8584644580.00,United States,2002,1195595,Consumer Services,Other Specialty Stores
DLB,Dolby Laboratories Common Stock,$77.92,-0.03,-0.038%,7933685053.00,United States,2005,216151,Technology,EDP Services
DLR,Digital Realty Trust Inc. Common Stock,$152.67,2.32,1.543%,43429897955.00,United States,2004,1451981,Consumer Services,Real Estate Investment Trusts
DLTH,Duluth Holdings Inc. Class B Common Stock,$12.38,-0.12,-0.96%,409190198.00,United States,2015,49237,Consumer Services,Department/Specialty Retail Stores
DLTR,Dollar Tree Inc. Common Stock,$174.08,2.21,1.286%,39187206072.00,United States,1995,2726829,Consumer Services,Department/Specialty Retail Stores
DLX,Deluxe Corporation Common Stock,$29.96,0.44,1.491%,1283950091.00,United States,,152583,Technology,Advertising
DMLP,Dorchester Minerals L.P. Common Units Representing Limited Partnership Interests,$25.96,0.21,0.816%,974921933.00,United States,,79426,Energy,Oil & Gas Production
DMRC,Digimarc Corporation Common Stock,$27.03,-0.64,-2.313%,478076366.00,United States,,69863,Technology,EDP Services
DMTK,DermTech Inc. Common Stock,$11.08,0.12,1.095%,331735732.00,United States,2017,340916,Health Care,Managed Health Care
DNA,Ginkgo Bioworks Holdings Inc. Class A Common Stock,$3.64,-0.18,-4.712%,6404959565.00,United States,2021,15696653,Health Care,Biotechnology: Biological Products (No Diagnostic Substances)
DNAA,Social Capital Suvretta Holdings Corp. I Class A Ordinary Share,$9.885,-0.005,-0.051%,315232650.00,United States,2021,457411,,
DNAB,Social Capital Suvretta Holdings Corp. II Class A Ordinary Shares,$9.74,-0.01,-0.103%,310608600.00,United States,2021,30145,,
DNAC,Social Capital Suvretta Holdings Corp. III Class A ordinary shares,$9.886,0.006,0.061%,315264540.00,United States,2021,28215,,
DNAD,Social Capital Suvretta Holdings Corp. IV Class A Ordinary Shares,$9.735,-0.005,-0.051%,310449150.00,United States,2021,24913,Health Care,Biotechnology: Pharmaceutical Preparations
DNB,Dun & Bradstreet Holdings Inc. Common Stock,$17.60,0.01,0.057%,7588519611.00,United States,2020,801353,Technology,EDP Services
DNLI,Denali Therapeutics Inc. Common Stock,$28.27,-0.04,-0.141%,3472499822.00,United States,2017,317170,Health Care,Biotechnology: Biological Products (No Diagnostic Substances)
DNP,DNP Select Income Fund Inc. Common Stock,$11.94,0.03,0.252%,4121629100.00,United States,1987,454298,Finance,Investment Managers
DNUT,Krispy Kreme Inc. Common Stock,$14.41,0.07,0.488%,2410084821.00,United States,2021,645439,Consumer Services,Specialty Foods
DOC,Physicians Realty Trust Common Shares of Beneficial Interest,$17.66,0.26,1.494%,3976065557.00,United States,2013,2091648,Consumer Services,Real Estate Investment Trusts
DOCN,DigitalOcean Holdings Inc. Common Stock,$47.61,-3.38,-6.629%,5123466928.00,United States,2021,1849028,Technology,Retail: Computer Software & Peripheral Equipment
DOCU,DocuSign Inc. Common Stock,$92.74,-9.29,-9.105%,18443098726.00,United States,2018,4836133,Technology,EDP Services
DOMO,Domo Inc. Class B Common Stock,$45.79,-1.63,-3.437%,1510786743.00,United States,2018,204885,Technology,Computer Software: Prepackaged Software
DORM,Dorman Products Inc. Common Stock,$95.93,0.28,0.293%,3024460319.00,United States,,92636,Capital Goods,Auto Parts:O.E.M.
DOV,Dover Corporation Common Stock,$155.52,3.84,2.532%,22411387981.00,United States,,1154572,Capital Goods,Industrial Machinery/Components
DPG,Duff & Phelps Utility and Infrastructure Fund Inc.,$15.45,0.16,1.046%,586982163.00,United States,2011,95217,Finance,Trusts Except Educational Religious and Charitable
DPZ,Domino's Pizza Inc Common Stock,$396.49,2.41,0.612%,14286847875.00,United States,2004,324190,Consumer Non-Durables,Food Distributors
DRAY,Macondray Capital Acquisition Corp. I Class A Ordinary Shares,$9.93,0.00,0.00%,356859375.00,United States,2021,16,,
DRE,Duke Realty Corporation Common Stock,$61.53,1.32,2.192%,23551697319.00,United States,,1444232,Consumer Services,Real Estate Investment Trusts
DRH,Diamondrock Hospitality Company Common Stock,$10.31,0.06,0.585%,2190560040.00,United States,2005,2042702,Consumer Services,Real Estate Investment Trusts
DRI,Darden Restaurants Inc. Common Stock,$136.58,1.18,0.871%,17036216157.00,United States,,698056,Consumer Services,Restaurants
DRQ,Dril-Quip Inc. Common Stock,$34.96,-1.12,-3.104%,1216345346.00,United States,1997,252399,Energy,Metal Fabrications
DRVN,Driven Brands Holdings Inc. Common Stock,$27.28,0.45,1.677%,4569586295.00,United States,2021,271399,,
DSEY,Diversey Holdings Ltd. Ordinary Shares,$8.15,0.18,2.258%,2642154515.00,United States,2021,550182,Consumer Durables,Specialty Chemicals
DSGN,Design Therapeutics Inc. Common Stock,$14.76,0.35,2.429%,822134303.00,United States,2021,77821,Health Care,Biotechnology: Pharmaceutical Preparations
DSKE,Daseke Inc. Common Stock,$8.30,0.17,2.091%,526085457.00,United States,2015,297243,,
DSM,BNY Mellon Strategic Municipal Bond Fund Inc. Common Stock,$6.64,0.08,1.22%,328158833.00,United States,1989,178499,Finance,Investment Managers
DSU,Blackrock Debt Strategies Fund Inc. Common Stock,$10.33,0.06,0.584%,481446085.00,United States,1998,216964,Finance,Finance Companies
DT,Dynatrace Inc. Common Stock,$42.58,-0.29,-0.676%,12167005579.00,United States,2019,2609626,Technology,EDP Services
DTE,DTE Energy Company Common Stock,$139.12,1.35,0.98%,26953368954.00,United States,,785160,Public Utilities,Electric Utilities: Central
DTOC,Digital Transformation Opportunities Corp. Class A Common Stock,$9.79,0.01,0.102%,408120625.00,United States,2021,10399,Consumer Durables,Consumer Electronics/Appliances
DUK,Duke Energy Corporation (Holding Company) Common Stock,$115.43,0.96,0.839%,88869495476.00,United States,,2152864,Public Utilities,Power Generation
DUOL,Duolingo Inc. Class A Common Stock,$89.37,-0.72,-0.799%,3451942525.00,United States,2021,557287,Technology,Computer Software: Prepackaged Software
DVA,DaVita Inc. Common Stock,$123.38,2.62,2.17%,11826206558.00,United States,,387360,Health Care,Medical/Nursing Services
DVAX,Dynavax Technologies Corporation Common Stock,$10.07,-0.17,-1.66%,1271958507.00,United States,2004,1148328,Health Care,Biotechnology: Pharmaceutical Preparations
DVN,Devon Energy Corporation Common Stock,$64.61,1.61,2.556%,42913962000.00,United States,,7116401,Energy,Oil & Gas Production
DWAC,Digital World Acquisition Corp. Class A Common Stock,$45.91,-2.90,-5.941%,1708528438.00,United States,2021,1581685,Consumer Durables,Consumer Electronics/Appliances
DX,Dynex Capital Inc. Common Stock,$15.44,0.09,0.586%,566120029.00,United States,,863074,Consumer Services,Real Estate Investment Trusts
DXCM,DexCom Inc. Common Stock,$496.39,4.60,0.935%,48708731882.00,United States,2005,541582,Health Care,Medical Specialities
DXLG,Destination XL Group Inc. Common Stock,$5.11,-0.14,-2.667%,328578887.00,United States,,409544,Consumer Services,Clothing/Shoe/Accessory Stores
DXPE,DXP Enterprises Inc. Common Stock,$25.98,-0.06,-0.23%,483432099.00,United States,,31624,Capital Goods,Industrial Machinery/Components
DY,Dycom Industries Inc. Common Stock,$94.58,0.92,0.982%,2802295498.00,United States,,145480,Basic Industries,Water Sewer Pipeline Comm & Power Line Construction
DYN,Dyne Therapeutics Inc. Common Stock,$8.88,-0.09,-1.003%,458537457.00,United States,2020,83903,Consumer Durables,Specialty Chemicals
DZSI,DZS Inc. Common Stock,$12.67,0.16,1.279%,349109079.00,United States,,34560,Public Utilities,Telecommunications Equipment
EA,Electronic Arts Inc. Common Stock,$123.31,-0.73,-0.589%,34677517867.00,United States,,1571568,Technology,Computer Software: Prepackaged Software
EAC,Edify Acquisition Corp. Class A Common Stock,$9.82,0.01,0.102%,338790000.00,United States,2021,133538,Consumer Durables,Consumer Electronics/Appliances
EAD,Allspring Income Opportunities Fund Common Shares,$7.72,0.08,1.047%,467725572.00,United States,2003,169342,Finance,Finance/Investors Services
EAF,GrafTech International Ltd. Common Stock,$10.11,0.10,0.999%,2641345970.00,United States,2018,1005088,Consumer Durables,Metal Fabrications
EAT,Brinker International Inc. Common Stock,$37.49,0.23,0.617%,1672022658.00,United States,,689158,Consumer Services,Restaurants
EB,Eventbrite Inc. Class A Common Stock,$12.58,-0.66,-4.985%,1227264846.00,United States,2018,996991,Technology,EDP Services
EBAY,eBay Inc. Common Stock,$54.86,-0.31,-0.562%,32231836277.00,United States,1998,4937377,Consumer Services,Catalog/Specialty Distribution
EBC,Eastern Bankshares Inc. Common Stock,$21.07,0.09,0.429%,3875400865.00,United States,2020,377707,Finance,Major Banks
EBF,Ennis Inc. Common Stock,$18.28,0.09,0.495%,475621946.00,United States,,48493,Consumer Services,Office Equipment/Supplies/Services
EBIX,Ebix Inc. Common Stock,$32.22,-0.76,-2.304%,995753010.00,United States,,151420,Technology,EDP Services
EBS,Emergent Biosolutions Inc. Common Stock,$40.95,-0.23,-0.559%,2066066034.00,United States,2006,329378,Health Care,Biotechnology: Pharmaceutical Preparations
EBTC,Enterprise Bancorp Inc Common Stock,$39.52,0.75,1.934%,476360327.00,United States,,8251,Finance,Major Banks
ECC           ,Eagle Point Credit Company Inc. Common Stock,$13.12,0.03,0.229%,541385044.00,United States,2014,205245,Finance,Trusts Except Educational Religious and Charitable
ECL,Ecolab Inc. Common Stock,$182.26,1.50,0.83%,52180315886.00,United States,,1165627,Consumer Non-Durables,Package Goods/Cosmetics
ECOL,US Ecology Inc Common Stock,$47.96,0.01,0.021%,1502948083.00,United States,,1280292,Public Utilities,Environmental Services
ECOM          ,ChannelAdvisor Corporation Common Stock,$15.26,-0.20,-1.294%,464690867.00,United States,2013,199764,Technology,Computer Software: Prepackaged Software
ECPG,Encore Capital Group Inc Common Stock,$59.78,0.09,0.151%,1466472565.00,United States,,286786,,
ECVT,Ecovyst Inc. Common Stock,$11.54,0.22,1.943%,1594894736.00,United States,2017,308492,Basic Industries,Major Chemicals
ED,Consolidated Edison Inc. Common Stock,$98.41,0.40,0.408%,34856098883.00,United States,,1344132,Public Utilities,Power Generation
EDD,Morgan Stanley Emerging Markets Domestic Debt Fund Inc. Morgan Stanley Emerging Markets Domestic Debt Fund Inc. Common Stock,$4.79,0.06,1.268%,316581279.00,United States,2007,256001,Finance,Finance Companies
EDIT,Editas Medicine Inc. Common Stock,$15.37,-0.41,-2.598%,1053136584.00,United States,2016,956827,Health Care,Biotechnology: Pharmaceutical Preparations
EEFT,Euronet Worldwide Inc. Common Stock,$135.91,0.20,0.147%,6956015690.00,United States,1997,249002,Technology,EDP Services
EFC,Ellington Financial Inc. Common Stock ,$16.82,0.37,2.249%,975029649.00,United States,2010,819589,Consumer Services,Real Estate Investment Trusts
EFR,Eaton Vance Senior Floating-Rate Fund Common Shares of Beneficial Interest,$13.48,0.03,0.223%,401187824.00,United States,2003,68873,Finance,Trusts Except Educational Religious and Charitable
EFSC,Enterprise Financial Services Corporation Common Stock,$48.00,0.80,1.695%,1811404320.00,United States,,132625,Finance,Major Banks
EFT,Eaton Vance Floating Rate Income Trust Common Shares of Beneficial Interest,$13.40,-0.14,-1.034%,387455747.00,United States,2004,262349,Finance,Finance Companies
EFX,Equifax Inc. Common Stock,$221.41,2.98,1.364%,27213322429.00,United States,,1333666,Technology,Advertising
EGAN,eGain Corporation Common Stock,$10.96,-0.29,-2.578%,345170448.00,United States,1999,33509,Technology,Computer Software: Prepackaged Software
EGBN,Eagle Bancorp Inc. Common Stock,$56.19,0.46,0.825%,1804788749.00,United States,,150589,Finance,Major Banks
EGHT,8x8 Inc Common Stock,$10.40,-0.69,-6.222%,1230643274.00,United States,,1674511,Technology,EDP Services
EGLE,Eagle Bulk Shipping Inc. Common Stock,$69.55,-0.02,-0.029%,948193442.00,United States,,466389,Transportation,Marine Transportation
EGP,EastGroup Properties Inc. Common Stock,$215.63,6.80,3.256%,8987547671.00,United States,,453630,Consumer Services,Real Estate Investment Trusts
EGRX,Eagle Pharmaceuticals Inc. Common Stock,$50.26,0.23,0.46%,638156296.00,United States,2014,53566,Health Care,Biotechnology: Pharmaceutical Preparations
EGY,VAALCO Energy Inc.  Common Stock,$7.81,-0.09,-1.139%,458205109.00,United States,,1523802,Energy,Oil & Gas Production
EHC,Encompass Health Corporation Common Stock,$72.94,1.02,1.418%,7253023402.00,United States,,469655,Health Care,Medical Specialities
EIG,Employers Holdings Inc Common Stock,$42.81,1.05,2.514%,1187482145.00,United States,2007,79867,Finance,Property-Casualty Insurers
EIM,Eaton Vance Municipal Bond Fund Common Shares of Beneficial Interest $.01 par value,$11.06,0.20,1.842%,795802215.00,United States,2002,246665,Finance,Finance/Investors Services
EIX,Edison International Common Stock,$72.75,0.94,1.309%,27702922532.00,United States,,1179181,Public Utilities,Electric Utilities: Central
EJFA,EJF Acquisition Corp. Class A Ordinary Share,$9.90,0.00,0.00%,355781250.00,United States,2021,15463,Finance,Business Services
EL,Estee Lauder Companies Inc. (The) Common Stock,$278.26,3.70,1.348%,199605091710.00,United States,1995,1571765,Consumer Non-Durables,Package Goods/Cosmetics
ELAN,Elanco Animal Health Incorporated Common Stock,$26.28,0.16,0.613%,12442833201.00,United States,2018,2034396,Health Care,Biotechnology: Pharmaceutical Preparations
ELF,e.l.f. Beauty Inc. Common Stock,$25.94,0.23,0.895%,1352010517.00,United States,2016,250123,Consumer Non-Durables,Package Goods/Cosmetics
ELS,Equity Lifestyle Properties Inc. Common Stock,$82.67,1.50,1.848%,15377813920.00,United States,,983794,Consumer Services,Real Estate Investment Trusts
ELY,Callaway Golf Company Common Stock,$23.62,0.55,2.384%,4362185061.00,United States,1992,1960143,Consumer Non-Durables,Recreational Products/Toys
EMBC,Embecta Corp. Common Stock,$31.13,0.20,0.647%,1774410000.00,United States,,964538,Consumer Durables,Specialty Chemicals
EMBK,Embark Technology Inc. Common Stock,$5.96,0.13,2.23%,2681475323.00,United States,,1085098,Technology,Computer Software: Prepackaged Software
EMD,Western Asset Emerging Markets Debt Fund Inc Common Stock,$10.25,0.06,0.589%,622646623.00,United States,,198702,Finance,Finance/Investors Services
EME,EMCOR Group Inc. Common Stock,$118.18,2.09,1.80%,6224085489.00,United States,,625412,Capital Goods,Engineering & Construction
EMLD,FTAC Emerald Acquisition Corp. Class A Common Stock,$9.81,0.00,0.00%,338058133.00,United States,2022,282821,Consumer Durables,Consumer Electronics/Appliances
EMN,Eastman Chemical Company Common Stock,$111.00,1.43,1.305%,14313407598.00,United States,,1253577,Basic Industries,Major Chemicals
EMO,ClearBridge Energy Midstream Opportunity Fund Inc. Common Stock,$31.16,0.58,1.897%,408419012.00,United States,2011,88437,Finance,Investment Managers
EMR,Emerson Electric Company Common Stock,$97.14,1.45,1.515%,57701160000.00,United States,,2055387,Capital Goods,Industrial Machinery/Components
ENJY,Enjoy Technology Inc. Common Stock,$2.97,0.07,2.414%,356824698.00,United States,2021,342810,Miscellaneous,Diversified Commercial Services
ENOB,Enochian Biosciences Inc. Common Stock,$7.56,-0.02,-0.264%,397907499.00,United States,,202005,Health Care,Biotechnology: Pharmaceutical Preparations
ENOV,Enovis Corporation Common Stock,$70.47,0.11,0.156%,3789647079.00,United States,,525403,Capital Goods,Fluid Controls
ENPH,Enphase Energy Inc. Common Stock,$178.53,-17.07,-8.727%,24094005858.00,United States,2012,2795736,Capital Goods,Electrical Products
ENR,Energizer Holdings Inc. Common Stock,$31.16,0.01,0.032%,2220153957.00,United States,2015,450767,Basic Industries,Metal Fabrications
ENS,EnerSys Common Stock,$70.68,-0.18,-0.254%,2915564277.00,United States,2004,332334,Consumer Non-Durables,Telecommunications Equipment
ENSG,The Ensign Group Inc. Common Stock,$87.05,2.23,2.629%,4814568190.00,United States,2007,286918,Health Care,Hospital/Nursing Management
ENTA,Enanta Pharmaceuticals Inc. Common Stock,$75.79,3.09,4.25%,1555975142.00,United States,2013,196099,Health Care,Biotechnology: In Vitro & In Vivo Diagnostic Substances
ENTF,Enterprise 4.0 Technology Acquisition Corp. Class A Ordinary Shares,$9.98,0.02,0.201%,381236000.00,United States,2021,111214,,
ENTG,Entegris Inc. Common Stock,$118.68,2.08,1.784%,16121974821.00,United States,2000,1128310,Technology,Semiconductors
