Symbol,Name,Last Sale,Net Change,% Change,Market Cap,Country,IPO Year,Volume,Sector,Industry
A,Agilent Technologies Inc. Common Stock,$129.37,2.84,2.245%,38825667582.00,United States,1999,2026080,Capital Goods,Electrical Products
AADI,Aadi Bioscience Inc. Common Stock,$16.39,0.17,1.048%,343038029.00,United States,,68478,Health Care,Biotechnology: Pharmaceutical Preparations
AAL,American Airlines Group Inc. Common Stock,$19.48,-0.11,-0.562%,12645639079.00,United States,,43077715,Transportation,Air Freight/Delivery Services
AAN,Aarons Holdings Company Inc. Common Stock ,$21.57,-0.47,-2.132%,688837217.00,United States,2020,166500,Miscellaneous,Diversified Commercial Services
AAON,AAON Inc. Common Stock,$53.85,1.19,2.26%,2830921371.00,United States,,163006,Capital Goods,Industrial Machinery/Components
AAP,Advance Auto Parts Inc.,$228.02,5.12,2.297%,13930002427.00,United States,,586622,Consumer Services,Other Specialty Stores
AAPL,Apple Inc. Common Stock,$167.23,-0.17,-0.102%,2899323368200.00,United States,1980,67828409,Technology,Computer Manufacturing
AAT,American Assets Trust Inc. Common Stock,$36.79,0.41,1.127%,2226605962.00,United States,2011,306691,Consumer Services,Real Estate Investment Trusts
AAWW,Atlas Air Worldwide Holdings NEW Common Stock,$69.66,-1.38,-1.943%,1975809560.00,United States,,527023,Transportation,Transportation Services
AB,AllianceBernstein Holding L.P.  Units,$44.24,0.09,0.204%,4391781202.00,United States,,233589,Finance,Investment Managers
ABBV,AbbVie Inc. Common Stock,$156.70,0.35,0.224%,276776847591.00,United States,2012,6249155,Health Care,Other Pharmaceuticals
ABC,AmerisourceBergen Corporation Common Stock,$165.73,2.88,1.768%,34660346108.00,United States,,924297,Health Care,Other Pharmaceuticals
ABCB,Ameris Bancorp Common Stock,$42.74,0.38,0.897%,2977990279.00,United States,1994,499048,Finance,Major Banks
ABG,Asbury Automotive Group Inc Common Stock,$161.71,-2.51,-1.528%,3749800368.00,United States,2002,210327,Consumer Services,Other Specialty Stores
ABM,ABM Industries Incorporated Common Stock,$52.78,2.13,4.205%,3529348828.00,United States,,789615,Technology,Diversified Commercial Services
ABMD,ABIOMED Inc. Common Stock,$325.98,2.56,0.792%,14837370876.00,United States,,228857,Health Care,Medical/Dental Instruments
ABNB,Airbnb Inc. Class A Common Stock,$164.55,-5.57,-3.274%,98137456602.00,United States,2020,3984439,Transportation,Other Consumer Services
ABR,Arbor Realty Trust Common Stock,$17.50,0.20,1.156%,2787116255.00,United States,2004,1621021,Consumer Services,Real Estate Investment Trusts
ABSI,Absci Corporation Common Stock,$7.86,0.10,1.289%,729193367.00,United States,2021,258119,Health Care,Biotechnology: Pharmaceutical Preparations
ABT,Abbott Laboratories Common Stock,$122.64,2.66,2.217%,216273465225.00,United States,,8333665,Health Care,Medical/Dental Instruments
ABTX,Allegiance Bancshares Inc. Common Stock,$42.21,0.22,0.524%,859700863.00,United States,2015,35036,Finance,Major Banks
AC,Associated Capital Group Inc. Common Stock,$39.83,0.87,2.233%,878289378.00,United States,2015,10025,Finance,Investment Bankers/Brokers/Service
ACAB,Atlantic Coastal Acquisition Corp. II Class A Common Stock,$10.01,0.00,0.00%,300300000.00,United States,2022,1,Consumer Durables,Consumer Electronics/Appliances
ACAD,ACADIA Pharmaceuticals Inc. Common Stock,$22.32,0.60,2.762%,3598067655.00,United States,2004,2578422,Health Care,Biotechnology: Pharmaceutical Preparations
ACAH,Atlantic Coastal Acquisition Corp. Class A Common Stock,$9.77,-0.01,-0.102%,421331250.00,United States,2021,13850,Consumer Durables,Consumer Electronics/Appliances
ACC,American Campus Communities Inc Common Stock,$64.75,-0.05,-0.077%,9010410117.00,United States,2004,14674434,Consumer Services,Real Estate Investment Trusts
ACCD,Accolade Inc. Common Stock,$12.91,-0.94,-6.787%,864432686.00,United States,2020,424905,Consumer Services,Interactive Media
ACCO,Acco Brands Corporation Common Stock,$7.80,0.03,0.386%,755347148.00,United States,,297062,Consumer Services,Advertising
ACEL,Accel Entertainment Inc. ,$12.56,0.03,0.239%,1165548833.00,United States,2017,107928,Consumer Services,Recreational Products/Toys
ACET,Adicet Bio Inc. Common Stock ,$15.34,-0.56,-3.522%,300507962.00,United States,2018,268372,Health Care,Biotechnology: Pharmaceutical Preparations
ACHC,Acadia Healthcare Company Inc. Common Stock,$75.91,1.56,2.098%,6875811126.00,United States,,463300,Health Care,Hospital/Nursing Management
ACHR,Archer Aviation Inc. Class A Common Stock,$4.06,0.02,0.495%,953950966.00,United States,2020,1010924,Capital Goods,Aerospace
ACI,Albertsons Companies Inc. Class A Common Stock,$33.29,0.18,0.544%,16619700699.00,United States,2020,2540461,Consumer Services,Food Chains
ACIW,ACI Worldwide Inc. Common Stock,$29.03,0.47,1.646%,3340297963.00,United States,,523876,Technology,EDP Services
ACLS,Axcelis Technologies Inc. Common Stock,$57.93,-0.25,-0.43%,1922264948.00,United States,2000,380308,Technology,Industrial Machinery/Components
ACLX,Arcellx Inc. Common Stock,$12.04,-0.56,-4.444%,430268471.00,United States,2022,183425,Health Care,Biotechnology: Pharmaceutical Preparations
ACM,AECOM Common Stock,$78.05,-0.29,-0.37%,11031803745.00,United States,2007,1002628,Consumer Services,Military/Government/Technical
ACMR,ACM Research Inc. Class A Common Stock,$16.78,-0.26,-1.526%,985596591.00,United States,2017,337208,Technology,Industrial Machinery/Components
ACNB,ACNB Corporation Common Stock,$35.05,0.36,1.038%,304206170.00,United States,,32936,Finance,Major Banks
ACQR,Independence Holdings Corp. Class A Ordinary Share,$9.81,0.00,0.00%,609173120.00,United States,2021,17,Finance,Business Services
ACRE,Ares Commercial Real Estate Corporation Common Stock,$16.30,0.43,2.71%,770471790.00,United States,2012,490552,Consumer Services,Real Estate Investment Trusts
ACRS,Aclaris Therapeutics Inc. Common Stock,$15.82,-0.45,-2.766%,1045919398.00,United States,2015,215743,Health Care,Biotechnology: Commercial Physical & Biological Resarch
ACT,Enact Holdings Inc. Common Stock,$24.70,0.90,3.782%,4022177739.00,United States,2021,220832,Finance,Specialty Insurers
ACTD,ArcLight Clean Transition Corp. II Class A Ordinary Share,$10.05,0.02,0.199%,390898579.00,United States,2021,857408,,
ACVA,ACV Auctions Inc. Class A Common Stock,$13.92,-0.21,-1.486%,2175230418.00,United States,2021,740861,Technology,EDP Services
ADAL,Anthemis Digital Acquisitions I Corp Class A Ordinary Shares,$9.97,-0.02,-0.20%,300969375.00,United States,2021,406475,,
ADBE,Adobe Inc. Common Stock,$428.11,-8.29,-1.90%,202281975000.00,United States,1986,2094103,Technology,Computer Software: Prepackaged Software
ADC,Agree Realty Corporation Common Stock,$71.90,0.60,0.842%,5132410090.00,United States,,772647,Consumer Services,Real Estate Investment Trusts
ADER,26 Capital Acquisition Corp. Class A Common Stock,$9.87,0.01,0.101%,339281250.00,United States,2021,43016,Consumer Durables,Consumer Electronics/Appliances
ADGI,Adagio Therapeutics Inc. Common Stock,$3.18,-0.07,-2.154%,348767050.00,United States,2021,1631463,Health Care,Biotechnology: Pharmaceutical Preparations
ADI,Analog Devices Inc. Common Stock,$161.38,-0.94,-0.579%,84452595679.00,United States,,2582383,Technology,Semiconductors
ADM,Archer-Daniels-Midland Company Common Stock,$98.22,2.29,2.387%,55246537889.00,United States,,3257571,,
ADMA,ADMA Biologics Inc Common Stock,$2.08,0.03,1.463%,407514334.00,United States,,1395875,Health Care,Biotechnology: Pharmaceutical Preparations
ADP,Automatic Data Processing Inc. Common Stock,$232.62,3.02,1.315%,97710929544.00,United States,,1545703,Miscellaneous,Business Services
ADPT,Adaptive Biotechnologies Corporation Common Stock,$10.00,-0.34,-3.288%,1415837200.00,United States,2019,1027712,Health Care,Biotechnology: Biological Products (No Diagnostic Substances)
ADSK,Autodesk Inc. Common Stock,$201.92,-1.88,-0.922%,43878826110.00,United States,,1244459,Technology,Computer Software: Prepackaged Software
ADT,ADT Inc. Common Stock,$7.38,0.07,0.958%,6723626335.00,United States,2018,1447877,Consumer Services,Diversified Commercial Services
ADTH,AdTheorent Holding Company Inc. Common Stock,$9.30,-0.26,-2.72%,797419144.00,United States,2021,102464,Technology,Advertising
ADTN,ADTRAN Inc. Common Stock,$18.35,0.28,1.55%,904927259.00,United States,1994,403520,Capital Goods,Telecommunications Equipment
ADUS,Addus HomeCare Corporation Common Stock,$92.00,1.65,1.826%,1467584092.00,United States,2009,44389,Health Care,Medical/Nursing Services
ADV,Advantage Solutions Inc. Class A Common Stock,$5.25,-0.25,-4.545%,1670114796.00,United States,2019,594789,Technology,Advertising
ADX,Adams Diversified Equity Fund Inc.,$18.06,-0.03,-0.166%,2127997266.00,United States,,182410,Finance,Investment Managers
AEE,Ameren Corporation Common Stock,$98.51,1.89,1.956%,25424596128.00,United States,,1253292,Public Utilities,Power Generation
AEF,Aberdeen Emerging Markets Equity Income Fund Inc. Common Stock,$6.275,0.035,0.561%,318467407.00,United States,,23417,Finance,Finance/Investors Services
AEIS,Advanced Energy Industries Inc. Common Stock,$80.00,2.05,2.63%,3004694960.00,United States,1995,200845,Consumer Durables,Electrical Products
AEL,American Equity Investment Life Holding Company Common Stock,$40.60,0.02,0.049%,3936136464.00,United States,2003,342685,Finance,Life Insurance
AEO,American Eagle Outfitters Inc. Common Stock,$17.69,-0.09,-0.506%,2986822410.00,United States,,7885666,Consumer Services,Clothing/Shoe/Accessory Stores
AEP,American Electric Power Company Inc. Common Stock,$102.83,0.40,0.391%,51882551557.00,United States,,2335064,Public Utilities,Electric Utilities: Central
AERI,Aerie Pharmaceuticals Inc. Common Stock,$8.28,-0.16,-1.896%,400684717.00,United States,2013,539121,Health Care,Biotechnology: Biological Products (No Diagnostic Substances)
AES,The AES Corporation Common Stock,$24.91,0.49,2.007%,16624812987.00,United States,,7459080,Public Utilities,Electric Utilities: Central
AFB,AllianceBernstein National Municipal Income Fund Inc,$11.73,0.06,0.514%,337178099.00,United States,2002,68024,Finance,Trusts Except Educational Religious and Charitable
AFCG,AFC Gamma Inc. Common Stock,$17.68,-0.16,-0.897%,349055179.00,United States,2021,131678,Consumer Services,Real Estate Investment Trusts
AFG,American Financial Group Inc. Common Stock,$148.98,2.96,2.027%,12676801313.00,United States,,222633,Finance,Property-Casualty Insurers
AFL,AFLAC Incorporated Common Stock,$66.62,1.13,1.725%,43260896693.00,United States,,3368155,Finance,Accident &Health Insurance
AFRM,Affirm Holdings Inc. Class A Common Stock,$34.76,-2.27,-6.13%,9887724451.00,United States,2021,5505109,Technology,EDP Services
AGCO,AGCO Corporation Common Stock,$144.76,1.47,1.026%,10790629422.00,United States,,709496,Capital Goods,Industrial Machinery/Components
AGEN,Agenus Inc. Common Stock,$2.27,-0.03,-1.304%,583739262.00,United States,2000,2520775,Health Care,Biotechnology: Biological Products (No Diagnostic Substances)
AGGR,Agile Growth Corp. Class A Ordinary Share,$9.80,-0.0096,-0.098%,379750000.00,United States,2021,171036,Finance,Business Services
AGIO,Agios Pharmaceuticals Inc. Common Stock,$26.33,0.29,1.114%,1438605401.00,United States,2013,569279,Health Care,Biotechnology: Pharmaceutical Preparations
AGM,Federal Agricultural Mortgage Corporation Common Stock,$112.18,0.49,0.439%,1207898487.00,United States,,21360,Finance,Finance Companies
AGNC,AGNC Investment Corp. Common Stock,$11.99,0.13,1.096%,6267656497.00,United States,2008,9893276,Consumer Services,Real Estate Investment Trusts
AGR,Avangrid Inc. Common Stock,$49.22,0.56,1.151%,19027344255.00,United States,2015,685982,Public Utilities,Electric Utilities: Central
AGX,Argan Inc. Common Stock,$36.99,-0.18,-0.484%,548029377.00,United States,,246159,Capital Goods,Oilfield Services/Equipment
AGYS,Agilysys Inc. Common Stock (DE),$37.33,-0.88,-2.303%,922586014.00,United States,,52668,Technology,Computer Software: Prepackaged Software
AHCO,AdaptHealth Corp. Common Stock,$15.29,-0.35,-2.238%,2047462433.00,United States,2018,609924,Health Care,Biotechnology: Electromedical & Electrotherapeutic Apparatus
AHH,Armada Hoffler Properties Inc. Common Stock,$14.69,0.22,1.52%,988994158.00,United States,2013,385340,Consumer Services,Real Estate Investment Trusts
AIG,American International Group Inc. New Common Stock,$64.41,0.80,1.258%,55490872527.00,United States,,3432503,Finance,Life Insurance
AIMC,Altra Industrial Motion Corp. Common Stock,$37.01,0.19,0.516%,2407837180.00,United States,2006,198034,Capital Goods,Industrial Machinery/Components
AIN,Albany International Corporation Common Stock,$84.53,-0.06,-0.071%,2681325835.00,United States,,216931,Basic Industries,Textiles
AINV,Apollo Investment Corporation Common Stock,$13.59,0.17,1.267%,864965992.00,United States,2004,447527,Finance,Finance/Investors Services
AIP,Arteris Inc. Common Stock,$14.13,-0.30,-2.079%,446638321.00,United States,2021,33999,Technology,Semiconductors
AIR,AAR Corp. Common Stock,$51.14,0.08,0.157%,1799958062.00,United States,,367234,Capital Goods,Aerospace
AIRS,AirSculpt Technologies Inc. Common Stock,$11.43,-0.35,-2.971%,635966960.00,United States,2021,251442,Health Care,Hospital/Nursing Management
AIT,Applied Industrial Technologies Inc. Common Stock,$103.07,3.23,3.235%,3963713413.00,United States,,301599,Capital Goods,Industrial Machinery/Components
AIV,Apartment Investment and Management Company Common Stock,$6.97,0.16,2.349%,1063317209.00,United States,1994,879743,Consumer Services,Real Estate Investment Trusts
AIZ,Assurant Inc. Common Stock,$193.12,3.60,1.90%,11144646980.00,United States,2004,326058,Finance,Specialty Insurers
AJG,Arthur J. Gallagher & Co. Common Stock,$183.90,4.40,2.451%,38548042737.00,United States,,1184373,Finance,Specialty Insurers
AJRD,Aerojet Rocketdyne Holdings Inc. Common Stock,$42.00,-0.28,-0.662%,3382856274.00,United States,,990161,Capital Goods,Military/Government/Technical
AKAM,Akamai Technologies Inc. Common Stock,$121.92,0.58,0.478%,19617071866.00,United States,1999,1436470,Miscellaneous,Business Services
AKR,Acadia Realty Trust Common Stock,$21.75,0.24,1.116%,2036207552.00,United States,,356908,Consumer Services,Real Estate Investment Trusts
AKRO,Akero Therapeutics Inc. Common Stock,$11.20,-0.22,-1.926%,392144872.00,United States,2019,112524,Health Care,Biotechnology: Pharmaceutical Preparations
AKYA,Akoya BioSciences Inc. Common Stock,$10.86,-0.18,-1.63%,406981856.00,United States,2021,31848,Capital Goods,Medical Specialities
AL,Air Lease Corporation Class A Common Stock,$45.53,0.21,0.463%,5201761477.00,United States,2011,495739,Technology,Diversified Commercial Services
ALB,Albemarle Corporation Common Stock,$217.19,-0.96,-0.44%,25435640853.00,United States,,774028,Basic Industries,Industrial Specialties
ALBO,Albireo Pharma Inc. Common Stock,$35.40,-0.17,-0.478%,685411189.00,United States,,88936,Health Care,Biotechnology: Pharmaceutical Preparations
ALCO,Alico Inc. Common Stock,$43.00,-0.08,-0.186%,324452759.00,United States,,83097,,
ALE,Allete Inc.,$64.50,0.69,1.081%,3675778181.00,United States,,349971,Public Utilities,Power Generation
ALEC,Alector Inc. Common Stock,$11.30,-0.05,-0.441%,927049446.00,United States,2019,369049,Health Care,Biotechnology: Pharmaceutical Preparations
ALEX,Alexander & Baldwin Inc. Common Stock REIT Holding Company,$23.06,0.30,1.318%,1676009194.00,United States,,255478,Consumer Services,Real Estate Investment Trusts
ALG,Alamo Group Inc. Common Stock,$139.11,1.93,1.407%,1660493749.00,United States,,53139,Capital Goods,Industrial Machinery/Components
ALGM,Allegro MicroSystems Inc. Common Stock,$24.82,-0.15,-0.601%,4713660615.00,United States,2020,400732,Technology,Semiconductors
ALGN,Align Technology Inc. Common Stock,$419.18,-5.36,-1.263%,33033577150.00,United States,2001,626295,Health Care,Industrial Specialties
ALGT,Allegiant Travel Company Common Stock,$165.19,0.92,0.56%,2991925905.00,United States,2006,193367,Transportation,Air Freight/Delivery Services
ALHC,Alignment Healthcare Inc. Common Stock,$10.79,0.16,1.505%,2018453426.00,United States,2021,329271,Health Care,Medical Specialities
ALK,Alaska Air Group Inc. Common Stock,$58.69,0.42,0.721%,7400022965.00,United States,,2511180,Transportation,Air Freight/Delivery Services
ALKT,Alkami Technology Inc. Common Stock,$12.47,-0.35,-2.73%,1125057229.00,United States,2021,170270,Technology,EDP Services
ALL,Allstate Corporation (The) Common Stock,$143.86,2.12,1.496%,39701299695.00,United States,,1437066,Finance,Property-Casualty Insurers
ALLE,Allegion plc Ordinary Shares,$112.59,3.30,3.019%,9933865465.00,United States,2013,626931,Consumer Services,Diversified Commercial Services
ALLO,Allogene Therapeutics Inc. Common Stock,$7.92,-0.03,-0.377%,1130595856.00,United States,2018,1030093,Health Care,Biotechnology: Biological Products (No Diagnostic Substances)
ALLY,Ally Financial Inc. Common Stock,$44.25,-0.56,-1.25%,14483290500.00,United States,2014,9755274,Finance,Diversified Financial Services
ALNY,Alnylam Pharmaceuticals Inc. Common Stock,$167.95,6.75,4.187%,20274665693.00,United States,2004,528194,Health Care,Biotechnology: Pharmaceutical Preparations
ALRM,Alarm.com Holdings Inc. Common Stock,$59.99,-0.16,-0.266%,3018629011.00,United States,2015,238328,Technology,Computer Software: Prepackaged Software
ALRS,Alerus Financial Corporation Common Stock,$26.63,0.01,0.038%,463431424.00,United States,2019,15838,Finance,Commercial Banks
ALSN,Allison Transmission Holdings Inc. Common Stock,$37.23,0.99,2.732%,3613605118.00,United States,2012,796103,Capital Goods,Auto Parts:O.E.M.
ALTO,Alto Ingredients Inc. Common Stock,$6.38,-0.19,-2.892%,470380895.00,United States,,2344947,Basic Industries,Industrial Specialties
ALTR,Altair Engineering Inc. Class A Common Stock,$58.33,-0.39,-0.664%,4646064937.00,United States,2017,76840,Technology,Computer Software: Prepackaged Software
ALTU,Altitude Acquisition Corp. Class A Common Stock,$9.97,0.00,0.00%,373875000.00,United States,2021,75094,Consumer Durables,Consumer Electronics/Appliances
ALVR,AlloVir Inc. Common Stock,$6.25,0.84,15.527%,391683581.00,United States,2020,87706396,Health Care,Biotechnology: Pharmaceutical Preparations
ALX,Alexander's Inc. Common Stock,$265.95,1.72,0.651%,1358283776.00,United States,,13189,Consumer Services,Real Estate Investment Trusts
ALXO,ALX Oncology Holdings Inc. Common Stock,$15.85,0.29,1.864%,643999527.00,United States,2020,192672,Health Care,Biotechnology: Pharmaceutical Preparations
AM,Antero Midstream Corporation Common Stock,$11.45,0.04,0.351%,5469467488.00,United States,2017,3031959,Public Utilities,Natural Gas Distribution
AMAL,Amalgamated Financial Corp. Common Stock (DE),$18.08,-0.11,-0.605%,562561062.00,United States,2018,129753,Finance,Commercial Banks
AMAT,Applied Materials Inc. Common Stock,$117.89,0.83,0.709%,104143393992.00,United States,1972,8853172,Capital Goods,Industrial Machinery/Components
AMBA,Ambarella Inc. Ordinary Shares,$89.71,-2.46,-2.669%,3414838422.00,United States,2012,555517,Technology,Semiconductors
AMBC,Ambac Financial Group Inc. Common Stock,$8.45,-0.11,-1.285%,393307210.00,United States,,405639,Finance,Property-Casualty Insurers
AMCX,AMC Networks Inc. Class A Common Stock,$38.12,-1.73,-4.341%,1615376932.00,United States,,346704,Consumer Services,Broadcasting
AMD,Advanced Micro Devices Inc. Common Stock,$94.02,-2.91,-3.002%,153004854950.00,United States,,62423976,Technology,Semiconductors
AME,AMETEK Inc.,$132.11,1.98,1.522%,30539984957.00,United States,,869904,Consumer Durables,Metal Fabrications
AMED,Amedisys Inc Common Stock,$151.70,1.29,0.858%,4934151572.00,United States,,272752,Health Care,Medical/Nursing Services
AMEH,Apollo Medical Holdings Inc. Common Stock,$42.35,-0.35,-0.82%,1907044978.00,United States,,206873,Health Care,Managed Health Care
AMG,Affiliated Managers Group Inc. Common Stock,$140.03,2.18,1.581%,5457859551.00,United States,,180569,Finance,Investment Managers
AMGN,Amgen Inc. Common Stock,$255.38,2.01,0.793%,136317963756.00,United States,1983,1888085,Health Care,Biotechnology: Pharmaceutical Preparations
AMK,AssetMark Financial Holdings Inc. Common Stock,$21.34,-0.20,-0.929%,1569845111.00,United States,2019,27069,Finance,Finance/Investors Services
AMKR,Amkor Technology Inc. Common Stock,$19.77,0.02,0.101%,4839182118.00,United States,1998,800122,Technology,Semiconductors
AMLX,Amylyx Pharmaceuticals Inc. Common Stock,$10.89,0.09,0.833%,630140986.00,United States,2022,208723,Health Care,Biotechnology: Pharmaceutical Preparations
AMN,AMN Healthcare Services Inc AMN Healthcare Services Inc,$109.78,2.20,2.045%,5046646979.00,United States,,586548,Health Care,Assisted Living Services
AMNB,American National Bankshares Inc. Common Stock,$37.56,0.25,0.67%,402417427.00,United States,,14714,Finance,Major Banks
AMOT,Allied Motion Technologies Inc.,$27.48,0.18,0.659%,424900816.00,United States,,18816,Capital Goods,Electrical Products
AMP,Ameriprise Financial Inc. Common Stock,$300.84,3.21,1.079%,33266043945.00,United States,,553861,Finance,Investment Managers
AMPH,Amphastar Pharmaceuticals Inc. Common Stock,$39.11,0.07,0.179%,1909026721.00,United States,2014,270889,Health Care,Biotechnology: Pharmaceutical Preparations
AMPL,Amplitude Inc. Class A Common Stock,$20.75,-0.05,-0.24%,2283953911.00,United States,,800148,Technology,EDP Services
AMR,Alpha Metallurgical Resources Inc. Common Stock,$157.19,-1.09,-0.689%,2915452916.00,United States,2018,366287,Energy,Coal Mining
AMRC,Ameresco Inc. Class A Common Stock,$56.21,-0.27,-0.478%,2907423409.00,United States,2010,530222,Basic Industries,Water Sewer Pipeline Comm & Power Line Construction
AMRK,A-Mark Precious Metals Inc. Common Stock,$88.34,0.25,0.284%,1017147643.00,United States,,95298,Finance,Investment Bankers/Brokers/Service
AMRS,Amyris Inc. Common Stock,$4.15,-0.13,-3.037%,1319597366.00,United States,2010,3273715,Basic Industries,Industrial Specialties
AMSF,AMERISAFE Inc. Common Stock,$47.14,0.20,0.426%,912821506.00,United States,2005,85865,Finance,Accident &Health Insurance
AMSWA,American Software Inc. Class A Common Stock,$18.94,-0.02,-0.105%,635581891.00,United States,,41956,Technology,Computer Software: Prepackaged Software
AMT,American Tower Corporation (REIT) Common Stock,$267.59,8.82,3.408%,122085268825.00,United States,,1807119,Finance,Trusts Except Educational Religious and Charitable
AMTB,Amerant Bancorp Inc. Class A Common Stock,$29.94,0.77,2.64%,1036945732.00,United States,,101424,Finance,Major Banks
AMTX,Aemetis Inc. (DE) Common Stock,$11.80,-0.59,-4.762%,402515806.00,United States,,828485,Energy,Oilfield Services/Equipment
AMWD,American Woodmark Corporation Common Stock,$47.51,0.22,0.465%,787270109.00,United States,1986,76419,Consumer Durables,Building Products
AMWL,American Well Corporation Class A Common Stock,$3.69,-0.04,-1.072%,971631815.00,United States,2020,1320187,Technology,Retail: Computer Software & Peripheral Equipment
AMZN,Amazon.com Inc. Common Stock,$3079.96,-82.35,-2.604%,1566283582191.00,United States,1997,2977317,Consumer Services,Catalog/Specialty Distribution
AN,AutoNation Inc. Common Stock,$105.61,-3.03,-2.789%,6481450346.00,United States,,1006367,Consumer Services,Other Specialty Stores
ANAB,AnaptysBio Inc. Common Stock,$22.20,-0.12,-0.538%,614327902.00,United States,2017,123280,Health Care,Biotechnology: Pharmaceutical Preparations
ANAT,American National Group Inc. Common Stock,$189.20,0.00,0.00%,5087058240.00,United States,,70686,Finance,Life Insurance
ANDE,Andersons Inc. (The) Common Stock,$58.03,1.77,3.146%,1972309655.00,United States,,552462,Consumer Non-Durables,Tobacco
ANF,Abercrombie & Fitch Company Common Stock,$37.19,0.19,0.514%,1882770787.00,United States,,1759544,Consumer Services,Clothing/Shoe/Accessory Stores
ANGI,Angi Inc. Class A Common Stock,$4.96,-0.29,-5.524%,2488067738.00,United States,,1876620,Technology,EDP Services
ANGO,AngioDynamics Inc. Common Stock,$24.49,0.47,1.957%,949724673.00,United States,2004,240809,Health Care,Medical/Dental Instruments
ANIK,Anika Therapeutics Inc. Common Stock,$23.50,0.14,0.599%,339974735.00,United States,,77094,Health Care,Biotechnology: Electromedical & Electrotherapeutic Apparatus
ANIP,ANI Pharmaceuticals Inc.,$32.79,-0.20,-0.606%,566351569.00,United States,,102474,Health Care,Biotechnology: Biological Products (No Diagnostic Substances)
ANSS,ANSYS Inc. Common Stock,$291.25,-0.21,-0.072%,25346338519.00,United States,1996,379039,Technology,Computer Software: Prepackaged Software
ANTM,Anthem Inc. Common Stock,$529.84,12.80,2.476%,127816340243.00,United States,,1590913,Health Care,Medical Specialities
ANZU,Anzu Special Acquisition Corp I Class A Common Stock,$9.84,0.00,0.00%,522750000.00,United States,2021,125264,Consumer Durables,Consumer Electronics/Appliances
AOD,Aberdeen Total Dynamic Dividend Fund Common Stock,$9.53,0.04,0.421%,1004757411.00,United States,2007,364192,Finance,Investment Managers
AON,Aon plc Class A Ordinary Shares (Ireland),$333.22,2.43,0.735%,71290572961.00,United States,,946480,Finance,Specialty Insurers
AORT,Artivion Inc. Common Stock,$22.60,0.18,0.803%,908062214.00,United States,,271642,Health Care,Medical/Dental Instruments
AOS,A.O. Smith Corporation Common Stock,$66.30,0.93,1.423%,10410606866.00,United States,,719468,Capital Goods,Industrial Machinery/Components
APA,APA Corporation Common Stock,$44.33,-0.06,-0.135%,15379282466.00,United States,,8776149,Energy,Oil & Gas Production
APAM,Artisan Partners Asset Management Inc. Class A Common Stock,$38.57,-0.09,-0.233%,2565486906.00,United States,2013,392625,Finance,Investment Managers
APD,Air Products and Chemicals Inc. Common Stock,$248.74,-0.83,-0.333%,55149982842.00,United States,,1414064,Basic Industries,Specialty Chemicals
APEI,American Public Education Inc. Common Stock,$21.88,0.02,0.091%,412576982.00,United States,2007,42320,Miscellaneous,Other Consumer Services
APH,Amphenol Corporation Common Stock,$72.54,1.43,2.011%,43345435754.00,United States,,2650091,Capital Goods,Electrical Products
