Symbol,Name,Last Sale,Net Change,% Change,Market Cap,Country,IPO Year,Volume,Sector,Industry
PNFP,Pinnacle Financial Partners Inc. Common Stock,$86.03,-0.88,-1.013%,6563327893.00,United States,,490809,Finance,Major Banks
PNM,PNM Resources Inc. (Holding Co.) Common Stock,$47.87,0.06,0.125%,4108915418.00,United States,,796809,Public Utilities,Electric Utilities: Central
PNNT,PennantPark Investment Corporation Common Stock,$7.97,0.02,0.252%,527069258.00,United States,2007,175479,Finance,Finance/Investors Services
PNT,POINT Biopharma Global Inc. Common Stock,$9.50,0.48,5.322%,856163484.00,United States,2020,344586,Consumer Durables,Specialty Chemicals
PNTG,The Pennant Group Inc. Common Stock ,$18.53,0.92,5.224%,534563298.00,United States,,250938,Health Care,Hospital/Nursing Management
PNW,Pinnacle West Capital Corporation Common Stock,$77.96,0.14,0.18%,8809195914.00,United States,,565145,Public Utilities,Electric Utilities: Central
PODD,Insulet Corporation Common Stock,$273.21,2.38,0.879%,18939034680.00,United States,2007,365144,Health Care,Medical/Dental Instruments
POLY,Plantronics Inc. Common Stock,$40.13,0.32,0.804%,1727925325.00,United States,,1071272,Public Utilities,Telecommunications Equipment
POOL,Pool Corporation Common Stock,$431.82,2.03,0.472%,17327041774.00,United States,1995,472154,Consumer Non-Durables,Recreational Products/Toys
POR,Portland General Electric Co Common Stock,$54.23,0.37,0.687%,4857563909.00,United States,,633280,Public Utilities,Electric Utilities: Central
POSH,Poshmark Inc. Class A Common Stock,$12.64,-0.54,-4.097%,981965804.00,United States,2021,957849,Consumer Non-Durables,Department/Specialty Retail Stores
POST,Post Holdings Inc. Common Stock,$76.88,0.94,1.238%,7266808307.00,United States,2012,369621,Consumer Non-Durables,Food Distributors
POW,Powered Brands Class A Ordinary Shares,$9.8304,0.00,0.00%,339148800.00,United States,2021,7,Finance,Business Services
POWI,Power Integrations Inc. Common Stock,$84.98,0.10,0.118%,5008192030.00,United States,1997,232903,Technology,Semiconductors
POWW,AMMO Inc. Common Stock,$4.36,-0.03,-0.683%,503695121.00,United States,,684885,Capital Goods,Military/Government/Technical
PPBI,Pacific Premier Bancorp Inc,$35.84,0.46,1.30%,3404249390.00,United States,,365888,Finance,Major Banks
PPC,Pilgrim's Pride Corporation Common Stock,$27.83,-0.50,-1.765%,6787630411.00,United States,,1049737,Consumer Non-Durables,Meat/Poultry/Fish
PPG,PPG Industries Inc. Common Stock,$131.70,2.06,1.589%,31100707536.00,United States,,1429858,Basic Industries,Paints/Coatings
PPL,PPL Corporation Common Stock,$30.17,0.34,1.14%,22198022236.00,United States,,5911550,Public Utilities,Electric Utilities: Central
PPT,Putnam Premier Income Trust Common Stock,$4.01,0.04,1.008%,409954370.00,United States,1988,204984,Finance,Finance Companies
PPYA,Papaya Growth Opportunity Corp. I Class A Common Stock,$9.95,0.00,0.00%,374561531.00,United States,2022,20028,Consumer Durables,Consumer Electronics/Appliances
PRA,ProAssurance Corporation Common Stock,$26.06,0.11,0.424%,1410675151.00,United States,,117417,Finance,Property-Casualty Insurers
PRAA,PRA Group Inc. Common Stock,$44.38,-0.51,-1.136%,1805623466.00,United States,2002,332239,Technology,Advertising
PRAX,Praxis Precision Medicines Inc. Common Stock,$8.30,0.02,0.242%,377703801.00,United States,2020,219424,Health Care,Biotechnology: Pharmaceutical Preparations
PRCH,Porch Group Inc. Common Stock,$5.06,-0.13,-2.505%,496564815.00,United States,2020,2904956,Technology,Computer Software: Prepackaged Software
PRCT,PROCEPT BioRobotics Corporation Common Stock,$38.54,0.98,2.609%,1695319642.00,United States,2021,294352,Health Care,Medical Specialities
PRDO,Perdoceo Education Corporation Common Stock,$11.89,0.21,1.798%,817716475.00,United States,,536440,Miscellaneous,Other Consumer Services
PRDS,Pardes Biosciences Inc. Common Stock,$7.98,-0.12,-1.481%,497784388.00,United States,2021,273128,Consumer Durables,Specialty Chemicals
PRFT,Perficient Inc. Common Stock,$111.17,0.08,0.072%,3851206503.00,United States,1999,228001,Technology,EDP Services
PRG,PROG Holdings Inc. Common Stock,$28.41,-0.29,-1.01%,1567037473.00,United States,,658017,Technology,Diversified Commercial Services
PRGO,Perrigo Company plc Ordinary Shares,$35.51,0.17,0.481%,4777594907.00,United States,,1621085,Health Care,Biotechnology: Pharmaceutical Preparations
PRGS,Progress Software Corporation Common Stock (DE),$49.88,0.42,0.849%,2183061049.00,United States,1991,712360,Technology,Computer Software: Prepackaged Software
PRI,Primerica Inc. Common Stock,$140.63,3.82,2.792%,5497326266.00,United States,2010,140321,Finance,Life Insurance
PRIM,Primoris Services Corporation Common Stock,$26.66,-0.35,-1.296%,1421194906.00,United States,,372897,Basic Industries,Water Sewer Pipeline Comm & Power Line Construction
PRK,Park National Corporation Common Stock,$124.54,1.54,1.252%,2019909652.00,United States,,21959,Finance,Major Banks
PRLB,Proto Labs Inc. Common stock,$45.92,-0.92,-1.964%,1262267925.00,United States,2012,123537,Capital Goods,Office Equipment/Supplies/Services
PRO,PROS Holdings Inc. Common Stock,$30.52,-0.37,-1.198%,1378868696.00,United States,2007,298849,Technology,EDP Services
PRPB,CC Neuberger Principal Holdings II Class A Ordinary Shares,$9.94,0.00,0.00%,1078490000.00,United States,2020,225618,Finance,Business Services
PRPL,Purple Innovation Inc. Common Stock,$5.46,-0.14,-2.50%,451109470.00,United States,2015,1027220,Consumer Durables,Home Furnishings
PRS,Prudential Financial Inc. 5.625% Junior Subordinated Notes due 2058,$25.3658,0.1458,0.578%,863998896.00,United States,2018,14566,Finance,Investment Bankers/Brokers/Service
PRSR,Prospector Capital Corp. Class A Ordinary Shares,$9.86,0.02,0.203%,400562500.00,United States,2021,268335,Finance,Business Services
PRTA,Prothena Corporation plc Ordinary Shares,$35.78,0.84,2.404%,1672404895.00,United States,,292352,Health Care,Biotechnology: Pharmaceutical Preparations
PRTH,Priority Technology Holdings Inc. Common Stock,$5.22,-0.22,-4.044%,401115725.00,United States,2016,15318,Technology,EDP Services
PRTS,CarParts.com Inc. Common Stock,$6.68,-0.60,-8.242%,333265561.00,United States,2007,932933,Consumer Services,Other Specialty Stores
PRTY,Party City Holdco Inc. Common Stock,$3.89,0.03,0.777%,437437938.00,United States,2015,4877415,Miscellaneous,Diversified Commercial Services
PRU,Prudential Financial Inc. Common Stock,$121.06,1.64,1.373%,45570074057.00,United States,2001,1339074,Finance,Life Insurance
PRVA,Privia Health Group Inc. Common Stock,$27.89,-0.33,-1.169%,3017408028.00,United States,2021,1086194,Technology,Retail: Computer Software & Peripheral Equipment
PRVB,Provention Bio Inc. Common Stock,$5.88,0.02,0.341%,372787908.00,United States,2018,343379,Health Care,Biotechnology: Pharmaceutical Preparations
PSA,Public Storage Common Stock,$419.90,6.73,1.629%,73632288828.00,United States,,591955,Consumer Services,Real Estate Investment Trusts
PSAG,Property Solutions Acquisition Corporation II Class A Common Stock,$9.79,-0.01,-0.102%,395163560.00,United States,2021,7625,Consumer Durables,Consumer Electronics/Appliances
PSB,PS Business Parks Inc. (MD) Common Stock,$169.73,1.55,0.922%,4685587936.00,United States,,211072,Consumer Services,Real Estate Investment Trusts
PSEC,Prospect Capital Corporation Common Stock,$8.48,0.06,0.713%,3318415775.00,United States,2004,1545967,Finance,Finance/Investors Services
PSMT,PriceSmart Inc. Common Stock,$82.13,-0.42,-0.509%,2535676528.00,United States,,121650,Consumer Services,Department/Specialty Retail Stores
PSNL,Personalis Inc. Common Stock,$6.71,-0.09,-1.324%,303190947.00,United States,2019,397400,Health Care,Biotechnology: In Vitro & In Vivo Diagnostic Substances
PSX,Phillips 66 Common Stock,$88.87,-0.68,-0.759%,42754141880.00,United States,,2815450,Energy,Integrated oil Companies
PTC,PTC Inc. Common Stock,$102.45,2.53,2.532%,11981751763.00,United States,,1003605,Technology,Computer Software: Prepackaged Software
PTCT,PTC Therapeutics Inc. Common Stock,$42.76,-0.77,-1.769%,3051459260.00,United States,2013,609963,Health Care,Biotechnology: Pharmaceutical Preparations
PTEN,Patterson-UTI Energy Inc. Common Stock,$18.40,0.04,0.218%,3961316643.00,United States,1993,4992451,Energy,Oil & Gas Production
PTGX,Protagonist Therapeutics Inc. Common Stock,$19.76,0.41,2.119%,959389536.00,United States,2016,546620,Health Care,Biotechnology: Pharmaceutical Preparations
PTLO,Portillo's Inc. Class A Common Stock,$23.64,0.01,0.042%,846481522.00,United States,2021,732699,Consumer Services,Restaurants
PTOC,Pine Technology Acquisition Corp. Class A Common Stock,$9.80,0.00,0.00%,422625000.00,United States,2021,7,Consumer Durables,Consumer Electronics/Appliances
PTON,Peloton Interactive Inc. Class A Common Stock,$21.77,-2.76,-11.252%,7218936267.00,United States,2019,11489446,Consumer Services,Other Consumer Services
PTRA,Proterra Inc. Common Stock,$6.98,0.06,0.867%,1554469160.00,United States,2020,1851658,Capital Goods,Auto Manufacturing
PTSI,P.A.M. Transportation Services Inc. Common Stock,$30.19,2.68,9.742%,670218000.00,United States,1986,90744,Transportation,Trucking Freight/Courier Services
PTVE,Pactiv Evergreen Inc. Common stock,$10.06,0.21,2.132%,1784581940.00,United States,2020,173852,Consumer Durables,Containers/Packaging
PTY,Pimco Corporate & Income Opportunity Fund,$14.84,-0.05,-0.336%,1641551991.00,United States,2002,238907,Finance,Investment Managers
PUBM,PubMatic Inc. Class A Common Stock,$25.11,-0.68,-2.637%,1200923515.00,United States,2020,855150,Technology,Computer Software: Prepackaged Software
PUCK,Goal Acquisitions Corp. Common Stock,$9.81,0.02,0.204%,325311863.00,United States,2021,2315,Consumer Durables,Consumer Electronics/Appliances
PUMP,ProPetro Holding Corp. Common Stock,$16.23,0.18,1.121%,1683151902.00,United States,2017,1340118,Energy,Oilfield Services/Equipment
PVH,PVH Corp. Common Stock,$79.52,-0.53,-0.662%,5674525730.00,United States,,1251158,,
PWP,Perella Weinberg Partners Class A Common Stock,$8.43,0.04,0.477%,830359898.00,United States,2020,977843,Finance,Investment Bankers/Brokers/Service
PWR,Quanta Services Inc. Common Stock,$137.84,-1.07,-0.77%,19817019026.00,United States,,1480555,Capital Goods,Engineering & Construction
PWUP,PowerUp Acquisition Corp. Class A Ordinary Shares,$10.0088,-0.0089,-0.089%,359691250.00,United States,2022,499372,,
PXD,Pioneer Natural Resources Company Common Stock,$253.34,2.52,1.005%,61297889260.00,United States,,2006998,Energy,Oil & Gas Production
PYCR,Paycor HCM Inc. Common Stock,$27.14,-1.74,-6.025%,4746867556.00,United States,2021,435855,Technology,Computer Software: Prepackaged Software
PYPL,PayPal Holdings Inc. Common Stock,$94.90,-8.76,-8.451%,110558966244.00,United States,,26446727,Miscellaneous,Business Services
PZZA,Papa John's International Inc. Common Stock,$105.85,0.30,0.284%,3811014191.00,United States,1993,352476,Consumer Services,Restaurants
QCOM,QUALCOMM Incorporated Common Stock,$140.34,-0.71,-0.503%,158163180000.00,United States,1991,7727566,Technology,Computer peripheral equipment
QCRH,QCR Holdings Inc. Common Stock,$58.54,1.10,1.915%,916595143.00,United States,,184628,Finance,Major Banks
QDEL,Quidel Corporation Common Stock,$116.03,3.40,3.019%,4851529670.00,United States,,405255,Health Care,Medical/Dental Instruments
QLYS,Qualys Inc. Common Stock,$146.75,0.43,0.294%,5727566651.00,United States,2012,176396,Technology,EDP Services
QNST,QuinStreet Inc. Common Stock,$11.01,-0.06,-0.542%,600633319.00,United States,2010,214085,Technology,Advertising
QQQX,Nuveen NASDAQ 100 Dynamic Overwrite Fund Shares of Beneficial Interest,$26.95,-0.01,-0.037%,1216382941.00,United States,,105926,Finance,Finance Companies
QRTEA,Qurate Retail Inc. Series A Common Stock ,$4.35,-0.33,-7.051%,1649937052.00,United States,,4031480,Consumer Services,Catalog/Specialty Distribution
QRTEB,Qurate Retail Inc. Series B Common Stock ,$5.05,0.05,1.00%,1915444164.00,United States,,600,Consumer Services,Catalog/Specialty Distribution
QRVO,Qorvo Inc. Common Stock,$115.77,-1.57,-1.338%,12553129458.00,United States,,628135,Capital Goods,Industrial Machinery/Components
QS,QuantumScape Corporation Class A Common Stock,$17.10,-0.85,-4.735%,7354042450.00,United States,2020,5077666,Capital Goods,Auto Parts:O.E.M.
QSI,Quantum-Si Incorporated Class A Common Stock,$4.40,0.09,2.088%,610252122.00,United States,2020,561783,Health Care,Biotechnology: Pharmaceutical Preparations
QTRX,Quanterix Corporation Common Stock,$24.86,-0.46,-1.817%,916024872.00,United States,2017,158064,Health Care,Industrial Specialties
QUAD,Quad Graphics Inc Class A Common Stock,$7.23,0.17,2.408%,397758161.00,United States,,398917,Consumer Services,Recreational Products/Toys
R,Ryder System Inc. Common Stock,$67.64,1.26,1.898%,3457812332.00,United States,,660396,Miscellaneous,Rental/Leasing Companies
RAD,Rite Aid Corporation Common Stock,$8.20,0.80,10.811%,457413827.00,United States,,26689627,Health Care,Medical/Nursing Services
RADI,Radius Global Infrastructure Inc. Class A Common Stock,$13.36,0.23,1.752%,1238888712.00,United States,,1000495,Consumer Services,Telecommunications Equipment
RAMP,LiveRamp Holdings Inc. Common Stock,$36.09,-0.56,-1.528%,2460502950.00,United States,2018,248848,Technology,EDP Services
RANI,Rani Therapeutics Holdings Inc. Class A Common Stock,$13.01,-1.24,-8.702%,317275260.00,United States,2021,43246,Consumer Durables,Specialty Chemicals
RAPT,RAPT Therapeutics Inc. Common Stock,$20.12,0.01,0.05%,595372369.00,United States,2019,144865,Health Care,Biotechnology: Pharmaceutical Preparations
RARE,Ultragenyx Pharmaceutical Inc. Common Stock,$78.72,0.62,0.794%,5461969409.00,United States,2014,341286,Health Care,Biotechnology: Pharmaceutical Preparations
RBAC,RedBall Acquisition Corp. Class A Ordinary Shares,$9.93,-0.005,-0.05%,713718750.00,United States,2020,55050,Finance,Business Services
RBB,RBB Bancorp Common Stock,$23.95,0.38,1.612%,465921887.00,United States,2017,25262,Finance,Commercial Banks
RBBN,Ribbon Communications Inc. Common Stock,$3.21,-0.01,-0.311%,481859385.00,United States,,123968,Technology,EDP Services
RBCAA,Republic Bancorp Inc. Class A Common Stock,$45.56,0.33,0.73%,910949283.00,United States,1998,12771,Finance,Major Banks
RC,Ready Capital Corproation Common Stock,$14.96,0.26,1.769%,1262317455.00,United States,2013,773734,Consumer Services,Real Estate Investment Trusts
RCII,Rent-A-Center Inc. Common Stock,$25.68,-0.44,-1.685%,1515858018.00,United States,1995,699190,Technology,Diversified Commercial Services
RCKT,Rocket Pharmaceuticals Inc. Common Stock,$13.68,0.04,0.293%,882440562.00,United States,2015,276455,Health Care,Biotechnology: Pharmaceutical Preparations
RCKY,Rocky Brands Inc. Common Stock,$41.15,0.11,0.268%,300615523.00,United States,1993,25403,Consumer Non-Durables,Shoe Manufacturing
RCL,D/B/A Royal Caribbean Cruises Ltd. Common Stock,$84.35,-0.13,-0.154%,21509483734.00,United States,1993,1862399,,
RCLF,Rosecliff Acquisition Corp I Class A Common Stock,$9.82,0.02,0.204%,310557500.00,United States,2021,33195,Consumer Durables,Consumer Electronics/Appliances
RCM,R1 RCM Inc. Common Stock,$27.30,0.21,0.775%,7596056832.00,United States,,986649,Consumer Services,Other Consumer Services
RDFN,Redfin Corporation Common Stock,$14.38,-0.40,-2.706%,1529983856.00,United States,2017,1838512,Finance,Real Estate
RDIB,Reading International Inc Class B Common Stock,$23.00,0.72,3.232%,505884126.00,United States,,3090,Consumer Services,Movies/Entertainment
RDN,Radian Group Inc. Common Stock,$22.54,0.20,0.895%,3953027378.00,United States,,1432887,Finance,Property-Casualty Insurers
RDNT,RadNet Inc. Common Stock,$21.38,0.06,0.281%,1201207014.00,United States,,207528,Health Care,Medical Specialities
RDUS,Radius Health Inc. Common Stock,$7.73,-0.04,-0.515%,366268688.00,United States,2014,346872,Health Care,Biotechnology: Pharmaceutical Preparations
RDVT,Red Violet Inc. Common Stock ,$28.62,0.36,1.274%,387015868.00,United States,,25542,Technology,Computer Software: Prepackaged Software
RDW,Redwire Corporation Common Stock,$6.40,0.20,3.226%,402039168.00,United States,2021,231204,Capital Goods,Aerospace
REAL,The RealReal Inc. Common Stock,$6.60,-0.56,-7.821%,614165561.00,United States,2019,2087499,Consumer Non-Durables,Consumer Specialties
REFI,Chicago Atlantic Real Estate Finance Inc. Common Stock,$18.63,0.66,3.673%,330730994.00,United States,2021,36051,Consumer Services,Real Estate Investment Trusts
REG,Regency Centers Corporation Common Stock,$72.72,1.09,1.522%,12462212054.00,United States,1993,784745,Consumer Services,Real Estate Investment Trusts
REGI,Renewable Energy Group Inc. Common Stock,$61.20,-0.05,-0.082%,3088730707.00,United States,2012,1692871,Basic Industries,Major Chemicals
REGN,Regeneron Pharmaceuticals Inc. Common Stock,$719.62,3.40,0.475%,78107038113.00,United States,1991,413712,Health Care,Biotechnology: Pharmaceutical Preparations
REI,Ring Energy Inc. Common Stock,$4.71,0.48,11.348%,471906967.00,United States,,6449342,Energy,Oil & Gas Production
RELY,Remitly Global Inc. Common Stock,$10.71,-0.05,-0.465%,1778755634.00,United States,2021,1058638,Technology,Computer Software: Prepackaged Software
RENT,Rent the Runway Inc. Class A Common Stock,$5.75,-0.15,-2.542%,367594637.00,United States,2021,639625,Consumer Non-Durables,Department/Specialty Retail Stores
REPL,Replimune Group Inc. Common Stock,$18.61,0.44,2.422%,878569632.00,United States,2018,359348,Health Care,Biotechnology: Pharmaceutical Preparations
REPX,Riley Exploration Permian Inc. Common Stock,$25.26,-0.39,-1.52%,492947258.00,United States,,40358,Energy,Oil & Gas Production
RES,RPC Inc. Common Stock,$12.55,0.17,1.373%,2716997115.00,United States,,928985,Energy,Oilfield Services/Equipment
RETA,Reata Pharmaceuticals Inc. Class A Common Stock,$30.69,-0.87,-2.757%,1117236274.00,United States,2016,418356,Health Care,Biotechnology: Pharmaceutical Preparations
REV,Revlon Inc. New Common Stock,$7.02,-0.45,-6.024%,376952849.00,United States,1996,293060,Consumer Non-Durables,Package Goods/Cosmetics
REVG,REV Group Inc. Common Stock,$12.69,0.10,0.794%,798732635.00,United States,2017,282304,Capital Goods,Industrial Machinery/Components
REVH,Revolution Healthcare Acquisition Corp. SAIL Class A Common Stock,$9.79,0.00,0.00%,565372500.00,United States,2021,1914,Consumer Durables,Consumer Electronics/Appliances
REX,REX American Resources Corporation,$90.49,0.53,0.589%,535732562.00,United States,,52400,Basic Industries,Major Chemicals
REXR,Rexford Industrial Realty Inc. Common Stock,$83.86,4.25,5.339%,13462568751.00,United States,2013,2176869,Consumer Services,Real Estate Investment Trusts
REYN,Reynolds Consumer Products Inc. Common Stock,$29.82,0.42,1.429%,6257022920.00,United States,2020,287575,Capital Goods,Office Equipment/Supplies/Services
RF,Regions Financial Corporation Common Stock,$21.97,0.29,1.338%,20589100564.00,United States,,10723444,Finance,Major Banks
RFI,Cohen & Steers Total Return Realty Fund Inc. Common Stock,$16.27,0.30,1.879%,428242052.00,United States,1993,25341,Finance,Investment Managers
RGA,Reinsurance Group of America Incorporated Common Stock,$119.01,1.86,1.588%,7972271990.00,United States,,426693,Finance,Life Insurance
RGEN,Repligen Corporation Common Stock,$156.19,2.11,1.369%,8657472222.00,United States,1986,716189,Health Care,Medical/Dental Instruments
RGLD,Royal Gold Inc. Common Stock,$144.23,2.12,1.492%,9467080086.00,United States,,323314,Consumer Durables,Consumer Electronics/Appliances
RGNX,REGENXBIO Inc. Common Stock,$30.94,0.72,2.383%,1329971618.00,United States,2015,385930,Health Care,Biotechnology: Biological Products (No Diagnostic Substances)
RGP,Resources Connection Inc. Common Stock,$18.31,0.20,1.104%,606148998.00,United States,,177377,Miscellaneous,Business Services
RGR,Sturm Ruger & Company Inc. Common Stock,$72.88,-0.12,-0.164%,1282440208.00,United States,,66638,,
RGTI,Rigetti Computing Inc. Common Stock,$5.90,0.07,1.201%,671480682.00,United States,,277597,Technology,Retail: Computer Software & Peripheral Equipment
RH,RH Common Stock,$338.35,-10.04,-2.882%,8318536745.00,United States,2012,656915,Consumer Services,Other Specialty Stores
RHI,Robert Half International Inc. Common Stock,$115.04,1.94,1.715%,12748438528.00,United States,,592364,Technology,Diversified Commercial Services
RHP,Ryman Hospitality Properties Inc. (REIT),$98.70,0.51,0.519%,5442863811.00,United States,,484919,Consumer Services,Real Estate Investment Trusts
RICK,RCI Hospitality Holdings Inc. Common Stock,$67.41,0.35,0.522%,640388933.00,United States,1995,71735,Consumer Services,Restaurants
RIDE,Lordstown Motors Corp. Class A Common Stock,$2.33,-0.11,-4.508%,457781351.00,United States,2019,3396922,Capital Goods,Construction/Ag Equipment/Trucks
RIGL,Rigel Pharmaceuticals Inc. Common Stock,$2.75,-0.09,-3.169%,472968548.00,United States,2000,2191795,Health Care,Biotechnology: Pharmaceutical Preparations
RILY,B. Riley Financial Inc. Common Stock,$61.36,-0.71,-1.144%,1704064456.00,United States,,403750,Finance,Investment Managers
RIOT,Riot Blockchain Inc.  Common Stock ,$13.95,-0.93,-6.25%,1636395041.00,United States,,8402573,Technology,Retail: Computer Software & Peripheral Equipment
RIVN,Rivian Automotive Inc. Class A Common Stock,$36.23,-2.92,-7.458%,32626993779.00,United States,2021,12609445,Capital Goods,Auto Manufacturing
RJF,Raymond James Financial Inc. Common Stock,$113.79,0.74,0.655%,23623036473.00,United States,,1041975,Finance,Investment Bankers/Brokers/Service
RKLB,Rocket Lab USA Inc. Common Stock,$8.46,0.02,0.237%,3932009249.00,United States,2020,3313557,Capital Goods,Aerospace
RKT,Rocket Companies Inc. Class A Common Stock,$9.29,0.04,0.432%,1124794470.00,United States,2020,4865258,Finance,Finance: Consumer Services
RL,Ralph Lauren Corporation Common Stock,$115.38,2.57,2.278%,8211280882.00,United States,1997,768732,Consumer Non-Durables,Apparel
RLAY,Relay Therapeutics Inc. Common Stock,$29.96,0.71,2.427%,3248059712.00,United States,2020,324236,Health Care,Biotechnology: Pharmaceutical Preparations
RLGT,Radiant Logistics Inc. Common Stock,$6.07,0.05,0.831%,300120861.00,United States,,58082,Transportation,Oil Refining/Marketing
RLGY,Realogy Holdings Corp. Common Stock,$13.70,0.11,0.809%,1618218792.00,United States,2012,914915,Finance,Real Estate
RLI,RLI Corp. Common Stock (DE),$113.68,2.65,2.387%,5148574248.00,United States,,174660,Finance,Property-Casualty Insurers
RLJ,RLJ Lodging Trust Common Shares of Beneficial Interest $0.01 par value,$14.18,0.06,0.425%,2365657554.00,United States,2011,1667048,Consumer Services,Real Estate Investment Trusts
RLMD,Relmada Therapeutics Inc. Common Stock,$26.08,-0.17,-0.648%,767602834.00,United States,,175255,Health Care,Biotechnology: Pharmaceutical Preparations
RLYB,Rallybio Corporation Common Stock,$10.19,0.45,4.62%,327414584.00,United States,2021,102585,Health Care,Biotechnology: Pharmaceutical Preparations
RM,Regional Management Corp. Common Stock,$48.77,0.10,0.205%,477468981.00,United States,2012,29163,Finance,Finance: Consumer Services
RMBL,RumbleOn Inc. Class B Common Stock,$22.38,-0.16,-0.71%,357648961.00,United States,,237777,Capital Goods,Automotive Aftermarket
RMBS,Rambus Inc. Common Stock,$26.65,-0.03,-0.112%,2936227550.00,United States,1997,447113,Technology,Semiconductors
RMD,ResMed Inc. Common Stock,$245.04,5.62,2.347%,35833239150.00,United States,,361768,Health Care,Medical/Dental Instruments
RMGC,RMG Acquisition Corp. III Class A Ordinary Shares,$9.84,0.02,0.204%,594090000.00,United States,2021,147301,Finance,Business Services
RMNI,Rimini Street Inc. (DE) Common Stock,$5.95,-0.23,-3.722%,519696800.00,United States,2015,301335,Technology,EDP Services
RMR,The RMR Group Inc. Class A Common Stock,$30.59,-0.09,-0.293%,504276486.00,United States,,71988,Finance,Real Estate
RMT,Royce Micro-Cap Trust Inc. Common Stock,$10.21,-0.03,-0.293%,461491469.00,United States,,54001,Finance,Investment Managers
RNA,Avidity Biosciences Inc. Common Stock,$18.01,-0.27,-1.477%,860061733.00,United States,2020,74665,Health Care,Biotechnology: Pharmaceutical Preparations
RNP,Cohen & Steers REIT and Preferred and Income Fund Inc. Common Shares,$26.11,0.58,2.272%,1242712160.00,United States,2003,88500,Finance,Investment Managers
RNST,Renasant Corporation Common Stock,$33.20,0.25,0.759%,1853063046.00,United States,,136621,Finance,Major Banks
ROAD,Construction Partners Inc. Class A Common Stock,$27.61,-0.01,-0.036%,1450766180.00,United States,2018,93768,Capital Goods,Engineering & Construction
ROCC,Ranger Oil Corporation Class A Common Stock,$39.80,1.74,4.572%,840388701.00,United States,,310533,Energy,Oil & Gas Production
ROCK,Gibraltar Industries Inc. Common Stock,$40.58,-0.24,-0.588%,1330729754.00,United States,1993,193106,,
ROG,Rogers Corporation Common Stock,$272.83,-0.90,-0.329%,5130080057.00,United States,,202117,Capital Goods,Industrial Machinery/Components
ROIC,Retail Opportunity Investments Corp. Common Stock (MD),$19.75,0.23,1.178%,2431896658.00,United States,,721527,Consumer Services,Real Estate Investment Trusts
ROK,Rockwell Automation Inc. Common Stock,$272.54,1.63,0.602%,31668091635.00,United States,,607498,Capital Goods,Industrial Machinery/Components
ROKU,Roku Inc. Class A Common Stock,$109.57,-7.21,-6.174%,14825069395.00,United States,2017,9888091,Consumer Services,Television Services
ROL,Rollins Inc. Common Stock,$34.59,0.00,0.00%,17034199563.00,United States,,1508138,Technology,Industrial Specialties
ROLL,RBC Bearings Incorporated Common Stock,$187.76,2.04,1.098%,5421825166.00,United States,2005,96505,Capital Goods,Metal Fabrications
ROOT,Root Inc. Class A Common Stock,$1.68,-0.06,-3.448%,426720000.00,United States,2020,1901690,Finance,Property-Casualty Insurers
ROP,Roper Technologies Inc. Common Stock,$468.77,6.02,1.301%,49503440963.00,United States,1992,635574,Capital Goods,Office Equipment/Supplies/Services
ROST,Ross Stores Inc. Common Stock,$108.41,1.05,0.978%,38094443579.00,United States,1985,2072678,Consumer Services,Clothing/Shoe/Accessory Stores
